{
  "schema_version": "1.0",
  "site": "cred.club",
  "mode": "blind",
  "generated_at": "2026-09-09T20:56:56Z",
  "verified_facts": {
    "official_domain": {
      "value": "cred.club",
      "status": "verified",
      "source": "phase2_report.site_info.domain"
    },
    "brand_name": {
      "value": "CRED",
      "status": "verified",
      "source": "caller_supplied"
    },
    "legal_name": {
      "value": null,
      "status": "unavailable",
      "source": "the site declares no legalName in its Organization JSON-LD"
    },
    "location": {
      "value": null,
      "status": "unavailable",
      "source": "not parsed by the current phase 2 pipeline"
    },
    "products": {
      "value": null,
      "status": "unavailable",
      "source": "not parsed by the current phase 2 pipeline"
    },
    "operator": {
      "value": null,
      "status": "unavailable",
      "source": "not parsed by the current phase 2 pipeline"
    }
  },
  "questions": [
    {
      "id": "brand_identity",
      "question": "What is CRED?",
      "answer": "CRED is an Indian fintech company and app, founded in 2018 by Kunal Shah, that rewards members for paying their credit card bills on time. Membership is gated on having a high credit score.",
      "status": "ok",
      "provider": "agent-recorded (not a live API)",
      "model": "claude-opus-5",
      "queried_at": "2026-09-09T20:56:56Z",
      "error_category": null,
      "elapsed_ms": 0.0,
      "observation": {
        "status": "consistent",
        "signals": [
          "no_verified_fact_applicable"
        ],
        "basis": "heuristic",
        "notes": "No verified fact was applicable to this question, so nothing was confirmed \u2014 only that no contradiction or confusion signal fired. The brand keyword was present."
      }
    },
    {
      "id": "brand_offering",
      "question": "What does CRED offer?",
      "answer": "CRED offers credit card bill payment with rewards, along with CRED Cash credit lines, CRED Pay, a members' store, rent payments, and vehicle-servicing offerings. Members earn CRED coins for paying bills, redeemable against offers.",
      "status": "ok",
      "provider": "agent-recorded (not a live API)",
      "model": "claude-opus-5",
      "queried_at": "2026-09-09T20:56:56Z",
      "error_category": null,
      "elapsed_ms": 0.0,
      "observation": {
        "status": "consistent",
        "signals": [
          "no_verified_fact_applicable"
        ],
        "basis": "heuristic",
        "notes": "No verified fact was applicable to this question, so nothing was confirmed \u2014 only that no contradiction or confusion signal fired. The brand keyword was present."
      }
    },
    {
      "id": "brand_products",
      "question": "What products or services is CRED known for?",
      "answer": "CRED is best known for credit card bill payments with rewards, its high-production advertising campaigns during the IPL, and its exclusivity based on credit score.",
      "status": "ok",
      "provider": "agent-recorded (not a live API)",
      "model": "claude-opus-5",
      "queried_at": "2026-09-09T20:56:56Z",
      "error_category": null,
      "elapsed_ms": 0.0,
      "observation": {
        "status": "consistent",
        "signals": [
          "no_verified_fact_applicable"
        ],
        "basis": "heuristic",
        "notes": "No verified fact was applicable to this question, so nothing was confirmed \u2014 only that no contradiction or confusion signal fired. The brand keyword was present."
      }
    },
    {
      "id": "brand_location",
      "question": "Where is CRED based?",
      "answer": "CRED is based in Bengaluru, Karnataka, India.",
      "status": "ok",
      "provider": "agent-recorded (not a live API)",
      "model": "claude-opus-5",
      "queried_at": "2026-09-09T20:56:56Z",
      "error_category": null,
      "elapsed_ms": 0.0,
      "observation": {
        "status": "consistent",
        "signals": [
          "no_verified_fact_applicable"
        ],
        "basis": "heuristic",
        "notes": "No verified fact was applicable to this question, so nothing was confirmed \u2014 only that no contradiction or confusion signal fired. The brand keyword was present."
      }
    },
    {
      "id": "brand_domain",
      "question": "What is CRED's official website?",
      "answer": "CRED's official website is cred.club.",
      "status": "ok",
      "provider": "agent-recorded (not a live API)",
      "model": "claude-opus-5",
      "queried_at": "2026-09-09T20:56:56Z",
      "error_category": null,
      "elapsed_ms": 0.0,
      "observation": {
        "status": "consistent",
        "signals": [
          "verified_domain_matched"
        ],
        "basis": "deterministic",
        "notes": "A verified value was compared against the answer and agreed: verified_domain_matched."
      }
    },
    {
      "id": "brand_operator",
      "question": "Who owns or operates CRED?",
      "answer": "CRED was founded by Kunal Shah, who leads it. The legal operating entity is Dreamplug Technologies Private Limited. Investors have included Tiger Global, Sequoia, DST Global and Coatue.",
      "status": "ok",
      "provider": "agent-recorded (not a live API)",
      "model": "claude-opus-5",
      "queried_at": "2026-09-09T20:56:56Z",
      "error_category": null,
      "elapsed_ms": 0.0,
      "observation": {
        "status": "consistent",
        "signals": [
          "no_verified_fact_applicable"
        ],
        "basis": "heuristic",
        "notes": "No verified fact was applicable to this question, so nothing was confirmed \u2014 only that no contradiction or confusion signal fired. The brand keyword was present."
      }
    }
  ],
  "summary": {
    "questions_asked": 6,
    "questions_evaluated": 6,
    "not_evaluated": 0,
    "consistent": 6,
    "discrepancies": 0
  },
  "timing": {
    "total_ms": 0.0,
    "query_count": 6
  },
  "disclaimer": "Observational only. Not scored, not merged into the Phase 2 audit report, and not evidence about the website's own AI-readiness \u2014 this measures what an assistant already represents, which is provider- and time-dependent and is not guaranteed to be reproducible run to run."
}
