{
  "schema_version": "1.0",
  "site": "tata.com",
  "mode": "blind",
  "generated_at": "2026-09-09T20:56:56Z",
  "verified_facts": {
    "official_domain": {
      "value": "tata.com",
      "status": "verified",
      "source": "phase2_report.site_info.domain"
    },
    "brand_name": {
      "value": "Tata",
      "status": "verified",
      "source": "caller_supplied"
    },
    "legal_name": {
      "value": null,
      "status": "unavailable",
      "source": "the site declares no legalName in its Organization JSON-LD"
    },
    "location": {
      "value": null,
      "status": "unavailable",
      "source": "not parsed by the current phase 2 pipeline"
    },
    "products": {
      "value": null,
      "status": "unavailable",
      "source": "not parsed by the current phase 2 pipeline"
    },
    "operator": {
      "value": null,
      "status": "unavailable",
      "source": "not parsed by the current phase 2 pipeline"
    }
  },
  "questions": [
    {
      "id": "brand_identity",
      "question": "What is Tata?",
      "answer": "Tata refers to the Tata Group, one of India's largest and oldest conglomerates, founded in 1868 by Jamsetji Tata. It is headquartered in Mumbai and operates across steel, automobiles, IT services, consumer goods, hospitality and aviation.",
      "status": "ok",
      "provider": "agent-recorded (not a live API)",
      "model": "claude-opus-5",
      "queried_at": "2026-09-09T20:56:56Z",
      "error_category": null,
      "elapsed_ms": 0.0,
      "observation": {
        "status": "consistent",
        "signals": [
          "no_verified_fact_applicable"
        ],
        "basis": "heuristic",
        "notes": "No verified fact was applicable to this question, so nothing was confirmed \u2014 only that no contradiction or confusion signal fired. The brand keyword was present."
      }
    },
    {
      "id": "brand_offering",
      "question": "What does Tata offer?",
      "answer": "The Tata Group offers an extremely broad range across sectors: steel (Tata Steel), vehicles (Tata Motors, which owns Jaguar Land Rover), IT services (TCS), consumer products such as tea and salt (Tata Consumer Products), hotels (Taj/IHCL), power, chemicals, airlines (Air India), and retail (Trent/Westside, Croma).",
      "status": "ok",
      "provider": "agent-recorded (not a live API)",
      "model": "claude-opus-5",
      "queried_at": "2026-09-09T20:56:56Z",
      "error_category": null,
      "elapsed_ms": 0.0,
      "observation": {
        "status": "consistent",
        "signals": [
          "no_verified_fact_applicable"
        ],
        "basis": "heuristic",
        "notes": "No verified fact was applicable to this question, so nothing was confirmed \u2014 only that no contradiction or confusion signal fired. The brand keyword was present."
      }
    },
    {
      "id": "brand_products",
      "question": "What products or services is Tata known for?",
      "answer": "Tata is best known for Tata Consultancy Services, Tata Steel, Tata Motors and Jaguar Land Rover, Tata Salt, Tata Tea and Tetley, Taj Hotels, Titan watches and Tanishq jewellery, and Air India.",
      "status": "ok",
      "provider": "agent-recorded (not a live API)",
      "model": "claude-opus-5",
      "queried_at": "2026-09-09T20:56:56Z",
      "error_category": null,
      "elapsed_ms": 0.0,
      "observation": {
        "status": "consistent",
        "signals": [
          "no_verified_fact_applicable"
        ],
        "basis": "heuristic",
        "notes": "No verified fact was applicable to this question, so nothing was confirmed \u2014 only that no contradiction or confusion signal fired. The brand keyword was present."
      }
    },
    {
      "id": "brand_location",
      "question": "Where is Tata based?",
      "answer": "Tata Group is based in Mumbai, Maharashtra, India. Its headquarters building is Bombay House in Mumbai.",
      "status": "ok",
      "provider": "agent-recorded (not a live API)",
      "model": "claude-opus-5",
      "queried_at": "2026-09-09T20:56:56Z",
      "error_category": null,
      "elapsed_ms": 0.0,
      "observation": {
        "status": "consistent",
        "signals": [
          "no_verified_fact_applicable"
        ],
        "basis": "heuristic",
        "notes": "No verified fact was applicable to this question, so nothing was confirmed \u2014 only that no contradiction or confusion signal fired. The brand keyword was present."
      }
    },
    {
      "id": "brand_domain",
      "question": "What is Tata's official website?",
      "answer": "The Tata Group's official website is tata.com.",
      "status": "ok",
      "provider": "agent-recorded (not a live API)",
      "model": "claude-opus-5",
      "queried_at": "2026-09-09T20:56:56Z",
      "error_category": null,
      "elapsed_ms": 0.0,
      "observation": {
        "status": "consistent",
        "signals": [
          "verified_domain_matched"
        ],
        "basis": "deterministic",
        "notes": "A verified value was compared against the answer and agreed: verified_domain_matched."
      }
    },
    {
      "id": "brand_operator",
      "question": "Who owns or operates Tata?",
      "answer": "The group holding company is Tata Sons. Around two-thirds of Tata Sons is owned by philanthropic trusts collectively known as the Tata Trusts. N. Chandrasekaran is chairman of Tata Sons. Ratan Tata, long associated with the group, died in 2024.",
      "status": "ok",
      "provider": "agent-recorded (not a live API)",
      "model": "claude-opus-5",
      "queried_at": "2026-09-09T20:56:56Z",
      "error_category": null,
      "elapsed_ms": 0.0,
      "observation": {
        "status": "consistent",
        "signals": [
          "no_verified_fact_applicable"
        ],
        "basis": "heuristic",
        "notes": "No verified fact was applicable to this question, so nothing was confirmed \u2014 only that no contradiction or confusion signal fired. The brand keyword was present."
      }
    }
  ],
  "summary": {
    "questions_asked": 6,
    "questions_evaluated": 6,
    "not_evaluated": 0,
    "consistent": 6,
    "discrepancies": 0
  },
  "timing": {
    "total_ms": 0.0,
    "query_count": 6
  },
  "disclaimer": "Observational only. Not scored, not merged into the Phase 2 audit report, and not evidence about the website's own AI-readiness \u2014 this measures what an assistant already represents, which is provider- and time-dependent and is not guaranteed to be reproducible run to run."
}
